{
  "authorityVersion": "0.1",
  "status": "draft",
  "sources": [{
    "id": "uh:source:authority-fixture",
    "title": "Narrator authority structural fixture",
    "citation": "Purpose-built test data; no historical claim.",
    "license": "CC0-1.0",
    "provenance": "Created for schema conformance testing."
  }],
  "persons": [{
    "id": "uh:person:authority-fixture-one",
    "preferredName": "الراوي التجريبي",
    "nameForms": [{
      "text": "الراوي التجريبي",
      "type": "preferred",
      "language": "ar",
      "citation": { "source": "uh:source:authority-fixture", "locator": "fixture 1", "quotation": "الراوي التجريبي" }
    }],
    "reviewState": "editor-reviewed"
  }, {
    "id": "uh:person:authority-fixture-two",
    "preferredName": "الراوي التجريبي الثاني",
    "nameForms": [{
      "text": "الراوي التجريبي الثاني",
      "type": "preferred",
      "language": "ar",
      "citation": { "source": "uh:source:authority-fixture", "locator": "fixture 3", "quotation": "الراوي التجريبي الثاني" }
    }],
    "reviewState": "editor-reviewed"
  }],
  "assertions": [{
    "id": "uh:assertion:authority-fixture-location",
    "subject": "uh:person:authority-fixture-one",
    "predicate": "location",
    "value": "مكان تجريبي غير تاريخي",
    "assertedBy": "Unified Hadith fixture editor",
    "citation": { "source": "uh:source:authority-fixture", "locator": "fixture 2", "quotation": "مكان تجريبي غير تاريخي" },
    "confidence": "certain",
    "reviewState": "editor-reviewed"
  }, {
    "id": "uh:assertion:authority-fixture-one-death",
    "subject": "uh:person:authority-fixture-one",
    "predicate": "death",
    "value": "100 (fixture year, not a historical date)",
    "assertedBy": "Unified Hadith fixture editor",
    "citation": { "source": "uh:source:authority-fixture", "locator": "fixture 4", "quotation": "100" },
    "confidence": "certain",
    "reviewState": "editor-reviewed"
  }, {
    "id": "uh:assertion:authority-fixture-two-birth",
    "subject": "uh:person:authority-fixture-two",
    "predicate": "birth",
    "value": "120 (fixture year, not a historical date)",
    "assertedBy": "Unified Hadith fixture editor",
    "citation": { "source": "uh:source:authority-fixture", "locator": "fixture 5", "quotation": "120" },
    "confidence": "certain",
    "reviewState": "editor-reviewed"
  }, {
    "id": "uh:assertion:authority-fixture-two-teacher",
    "subject": "uh:person:authority-fixture-two",
    "predicate": "teacher",
    "value": "uh:person:authority-fixture-one",
    "assertedBy": "Unified Hadith fixture editor",
    "citation": { "source": "uh:source:authority-fixture", "locator": "fixture 6", "quotation": "تجريبي: علاقة تلمذة غير تاريخية" },
    "confidence": "possible",
    "reviewState": "machine-suggested"
  }]
}
